{
  "$schema": "https://json-schema.org/draft/2020-12/schema",
  "type": "object",
  "required": [
    "id",
    "agent_id",
    "name",
    "category",
    "required_inputs",
    "methodology",
    "expected_outputs",
    "source"
  ],
  "properties": {
    "id": {
      "type": "string",
      "pattern": "^FW-(0[1-9]|[1-4][0-9]|50)$"
    },
    "agent_id": {
      "type": "string",
      "minLength": 1
    },
    "name": {
      "type": "string",
      "minLength": 1
    },
    "category": {
      "type": "string",
      "minLength": 1
    },
    "version": {
      "type": "string",
      "minLength": 1
    },
    "provenance": {
      "type": "string",
      "minLength": 1
    },
    "id_mapping": {
      "type": "string",
      "minLength": 1
    },
    "source": {
      "type": "object"
    },
    "source_original": {
      "type": "object"
    },
    "purpose": {
      "type": "string",
      "minLength": 1
    },
    "applicability": {
      "type": "array",
      "items": {
        "type": "string",
        "minLength": 1
      }
    },
    "activation_conditions": {
      "type": "array",
      "items": {
        "type": "string",
        "minLength": 1
      }
    },
    "required_inputs": {
      "type": "array",
      "items": {
        "type": "string",
        "minLength": 1
      }
    },
    "optional_inputs": {
      "type": "array",
      "items": {
        "type": "string",
        "minLength": 1
      }
    },
    "methodology": {
      "type": "array",
      "items": {
        "type": "string",
        "minLength": 1
      }
    },
    "methodology_provenance": {
      "type": "string",
      "minLength": 1
    },
    "expected_outputs": {
      "type": "array",
      "items": {
        "type": "string",
        "minLength": 1
      }
    },
    "mathematical_requirements": {
      "type": "string",
      "minLength": 1
    },
    "tool_requirements": {
      "type": "array",
      "items": {
        "type": "string",
        "minLength": 1
      }
    },
    "evidence_requirements": {
      "type": "array",
      "items": {
        "type": "string",
        "minLength": 1
      }
    },
    "limitations": {
      "type": "array",
      "items": {
        "type": "string",
        "minLength": 1
      }
    },
    "failure_modes": {
      "type": "array",
      "items": {
        "type": "string",
        "minLength": 1
      }
    },
    "relationships": {
      "type": "array",
      "items": {
        "type": "string",
        "minLength": 1
      }
    },
    "workflow_position": {
      "type": "string",
      "minLength": 1
    },
    "validation_criteria": {
      "type": "array",
      "items": {
        "type": "string",
        "minLength": 1
      }
    },
    "reference_material": {
      "type": "array",
      "items": {
        "type": "object"
      }
    }
  },
  "additionalProperties": false
}
