{
  "id": "FW-39",
  "agent_id": "AG-39",
  "name": "OKRs (Objectives & Key Results)",
  "category": "Execution Models",
  "version": "0.1.0",
  "provenance": "SOURCE_DERIVED",
  "id_mapping": "ENGINEERING_ADAPTATION: FW numeric correspondence to AG; source explicitly illustrates FW-11",
  "source": {
    "document": "Cognition Os Master Blueprint.md",
    "section": "4.1 / Execution Models",
    "line": 339
  },
  "source_original": {
    "purpose": "Penerjemahan keputusan strategis menjadi *Objectives* kualitatif dan *Key Results* kuantitatif terukur",
    "inputs": "Rekomendasi strategis akhir dan target metrik kuartalan/tahunan",
    "outputs": "Hierarki OKR tingkat korporat/tim beserta *leading & lagging indicators*"
  },
  "purpose": "Write a qualitative outcome objective",
  "applicability": [
    "objective",
    "baseline",
    "target",
    "horizon"
  ],
  "activation_conditions": [
    "User requests OKRs (Objectives & Key Results) or the orchestrator justifies it against the problem."
  ],
  "required_inputs": [
    "objective",
    "baseline",
    "target",
    "horizon"
  ],
  "optional_inputs": [
    "constraints",
    "evidence",
    "previous_findings",
    "desired_deliverable"
  ],
  "methodology": [
    "Write a qualitative outcome objective",
    "Define measurable key results with baseline, target, owner and deadline",
    "Separate outcomes from activity lists and leading from lagging indicators",
    "Schedule evidence-based reviews without inventing progress"
  ],
  "methodology_provenance": "ENGINEERING_ADAPTATION grounded in source scope",
  "expected_outputs": [
    "okrs",
    "indicators",
    "review_plan"
  ],
  "mathematical_requirements": "No unsupported numerical scores.",
  "tool_requirements": [
    "Host reasoning and resource reading; calculation tool when required."
  ],
  "evidence_requirements": [
    "Cite material claims; mark missing inputs UNKNOWN; do not reuse illustrative source conclusions."
  ],
  "limitations": [
    "Host-authored analysis requires behavioral evaluation; schema validity does not prove truth."
  ],
  "failure_modes": [
    "Invented inputs",
    "Generic analysis replacing distinctive method",
    "Unsupported certainty"
  ],
  "relationships": [],
  "workflow_position": "analysis",
  "validation_criteria": [
    "Provide okrs or declare it UNKNOWN with reason.",
    "Provide indicators or declare it UNKNOWN with reason.",
    "Provide review_plan or declare it UNKNOWN with reason.",
    "Use all distinctive methodology steps and identify missing evidence."
  ],
  "reference_material": [
    {
      "document": "Cognition Os Master Blueprint.md",
      "section": "4.1 / Execution Models",
      "line": 339
    }
  ]
}
