{
  "id": "FW-18",
  "agent_id": "AG-18",
  "name": "Causal Loop Diagrams (CLD)",
  "category": "Systems Thinking Models",
  "version": "0.1.0",
  "provenance": "SOURCE_DERIVED",
  "id_mapping": "ENGINEERING_ADAPTATION: FW numeric correspondence to AG; source explicitly illustrates FW-11",
  "source": {
    "document": "Cognition Os Master Blueprint.md",
    "section": "4.1 / Systems Thinking Models",
    "line": 303
  },
  "source_original": {
    "purpose": "Pemetaan putaran umpan balik penguat (*Reinforcing R*) dan penyeimbang (*Balancing B*)",
    "inputs": "Variabel-variabel sistem yang saling memengaruhi dari waktu ke waktu",
    "outputs": "Graf berarah dengan polaritas tautan (`+`/`-`) dan deteksi siklus *R/B*"
  },
  "purpose": "Set system boundary and time horizon",
  "applicability": [
    "variables",
    "relationships"
  ],
  "activation_conditions": [
    "User requests Causal Loop Diagrams (CLD) or the orchestrator justifies it against the problem."
  ],
  "required_inputs": [
    "variables",
    "relationships"
  ],
  "optional_inputs": [
    "constraints",
    "evidence",
    "previous_findings",
    "desired_deliverable"
  ],
  "methodology": [
    "Set system boundary and time horizon",
    "Draw directed influences with positive or negative polarity and supporting mechanism",
    "Mark delays and label reinforcing or balancing loops by sign product",
    "Keep observed associations distinct from causal hypotheses"
  ],
  "methodology_provenance": "ENGINEERING_ADAPTATION grounded in source scope",
  "expected_outputs": [
    "causal_graph",
    "loops",
    "delays"
  ],
  "mathematical_requirements": "No unsupported numerical scores.",
  "tool_requirements": [
    "Host reasoning and resource reading; calculation tool when required."
  ],
  "evidence_requirements": [
    "Cite material claims; mark missing inputs UNKNOWN; do not reuse illustrative source conclusions."
  ],
  "limitations": [
    "Host-authored analysis requires behavioral evaluation; schema validity does not prove truth."
  ],
  "failure_modes": [
    "Invented inputs",
    "Generic analysis replacing distinctive method",
    "Unsupported certainty"
  ],
  "relationships": [],
  "workflow_position": "analysis",
  "validation_criteria": [
    "Provide causal_graph or declare it UNKNOWN with reason.",
    "Provide loops or declare it UNKNOWN with reason.",
    "Provide delays or declare it UNKNOWN with reason.",
    "Use all distinctive methodology steps and identify missing evidence."
  ],
  "reference_material": [
    {
      "document": "Cognition Os Master Blueprint.md",
      "section": "4.1 / Systems Thinking Models",
      "line": 303
    }
  ]
}
