{
  "id": "FW-29",
  "agent_id": "AG-29",
  "name": "Ansoff Matrix",
  "category": "Strategic Models",
  "version": "0.1.0",
  "provenance": "SOURCE_DERIVED",
  "id_mapping": "ENGINEERING_ADAPTATION: FW numeric correspondence to AG; source explicitly illustrates FW-11",
  "source": {
    "document": "Cognition Os Master Blueprint.md",
    "section": "4.1 / Strategic Models",
    "line": 319
  },
  "source_original": {
    "purpose": "Penentuan vektor pertumbuhan korporat (*Market Penetration, Market Dev, Product Dev, Diversification*)",
    "inputs": "Portofolio produk saat ini, target pasar, dan profil toleransi risiko",
    "outputs": "Kuadran strategi pertumbuhan Ansoff beserta bobot risiko eksekusi"
  },
  "purpose": "Define existing versus new products and markets relative to the organization",
  "applicability": [
    "products",
    "markets",
    "risk_constraints"
  ],
  "activation_conditions": [
    "User requests Ansoff Matrix or the orchestrator justifies it against the problem."
  ],
  "required_inputs": [
    "products",
    "markets",
    "risk_constraints"
  ],
  "optional_inputs": [
    "constraints",
    "evidence",
    "previous_findings",
    "desired_deliverable"
  ],
  "methodology": [
    "Define existing versus new products and markets relative to the organization",
    "Map penetration, market development, product development and diversification",
    "Compare capability gaps and execution risks",
    "Do not invent numerical risk weights"
  ],
  "methodology_provenance": "ENGINEERING_ADAPTATION grounded in source scope",
  "expected_outputs": [
    "ansoff_quadrants",
    "options",
    "risks"
  ],
  "mathematical_requirements": "No unsupported numerical scores.",
  "tool_requirements": [
    "Host reasoning and resource reading; calculation tool when required."
  ],
  "evidence_requirements": [
    "Cite material claims; mark missing inputs UNKNOWN; do not reuse illustrative source conclusions."
  ],
  "limitations": [
    "Host-authored analysis requires behavioral evaluation; schema validity does not prove truth."
  ],
  "failure_modes": [
    "Invented inputs",
    "Generic analysis replacing distinctive method",
    "Unsupported certainty"
  ],
  "relationships": [],
  "workflow_position": "analysis",
  "validation_criteria": [
    "Provide ansoff_quadrants or declare it UNKNOWN with reason.",
    "Provide options or declare it UNKNOWN with reason.",
    "Provide risks or declare it UNKNOWN with reason.",
    "Use all distinctive methodology steps and identify missing evidence."
  ],
  "reference_material": [
    {
      "document": "Cognition Os Master Blueprint.md",
      "section": "4.1 / Strategic Models",
      "line": 319
    }
  ]
}
