{
  "id": "FW-26",
  "agent_id": "AG-26",
  "name": "OODA Loop",
  "category": "Strategic Models",
  "version": "0.1.0",
  "provenance": "SOURCE_DERIVED",
  "id_mapping": "ENGINEERING_ADAPTATION: FW numeric correspondence to AG; source explicitly illustrates FW-11",
  "source": {
    "document": "Cognition Os Master Blueprint.md",
    "section": "4.1 / Strategic Models",
    "line": 316
  },
  "source_original": {
    "purpose": "Percepatan siklus *Observe-Orient-Decide-Act* untuk mengungguli manuver kompetitor di pasar dinamis",
    "inputs": "Sinyal perubahan pasar, kecepatan respons organisasi saat ini",
    "outputs": "Protokol percepatan *OODA Loop* dan titik disrupsi ritme kompetitor"
  },
  "purpose": "Observe current signals and uncertainty",
  "applicability": [
    "observations",
    "context",
    "options"
  ],
  "activation_conditions": [
    "User requests OODA Loop or the orchestrator justifies it against the problem."
  ],
  "required_inputs": [
    "observations",
    "context",
    "options"
  ],
  "optional_inputs": [
    "constraints",
    "evidence",
    "previous_findings",
    "desired_deliverable"
  ],
  "methodology": [
    "Observe current signals and uncertainty",
    "Orient through context, assumptions, culture and competing interpretations",
    "Decide a bounded hypothesis or action",
    "Act with feedback and revisit orientation rather than optimizing speed alone"
  ],
  "methodology_provenance": "ENGINEERING_ADAPTATION grounded in source scope",
  "expected_outputs": [
    "ooda_cycle",
    "decision",
    "feedback"
  ],
  "mathematical_requirements": "No unsupported numerical scores.",
  "tool_requirements": [
    "Host reasoning and resource reading; calculation tool when required."
  ],
  "evidence_requirements": [
    "Cite material claims; mark missing inputs UNKNOWN; do not reuse illustrative source conclusions."
  ],
  "limitations": [
    "Host-authored analysis requires behavioral evaluation; schema validity does not prove truth."
  ],
  "failure_modes": [
    "Invented inputs",
    "Generic analysis replacing distinctive method",
    "Unsupported certainty"
  ],
  "relationships": [],
  "workflow_position": "analysis",
  "validation_criteria": [
    "Provide ooda_cycle or declare it UNKNOWN with reason.",
    "Provide decision or declare it UNKNOWN with reason.",
    "Provide feedback or declare it UNKNOWN with reason.",
    "Use all distinctive methodology steps and identify missing evidence."
  ],
  "reference_material": [
    {
      "document": "Cognition Os Master Blueprint.md",
      "section": "4.1 / Strategic Models",
      "line": 316
    }
  ]
}
