{
  "id": "FW-03",
  "agent_id": "AG-03",
  "name": "MoSCoW Method",
  "category": "Decision Models",
  "version": "0.1.0",
  "provenance": "SOURCE_DERIVED",
  "id_mapping": "ENGINEERING_ADAPTATION: FW numeric correspondence to AG; source explicitly illustrates FW-11",
  "source": {
    "document": "Cognition Os Master Blueprint.md",
    "section": "4.1 / Decision Models",
    "line": 278
  },
  "source_original": {
    "purpose": "Penetapan batas cakupan eksekusi (*Must-have, Should-have, Could-have, Won't-have*)",
    "inputs": "Daftar fitur/tindakan, batasan waktu & anggaran",
    "outputs": "Klasifikasi 4 kategori MoSCoW dengan bobot alokasi sumber daya"
  },
  "purpose": "Define the release or timebox and budget",
  "applicability": [
    "items",
    "constraints"
  ],
  "activation_conditions": [
    "User requests MoSCoW Method or the orchestrator justifies it against the problem."
  ],
  "required_inputs": [
    "items",
    "constraints"
  ],
  "optional_inputs": [
    "constraints",
    "evidence",
    "previous_findings",
    "desired_deliverable"
  ],
  "methodology": [
    "Define the release or timebox and budget",
    "Define Must as absence making the outcome unviable and distinguish Should from Could",
    "Place explicitly excluded scope in Won't for this timebox",
    "Check Must set feasibility against capacity"
  ],
  "methodology_provenance": "ENGINEERING_ADAPTATION grounded in source scope",
  "expected_outputs": [
    "must",
    "should",
    "could",
    "wont"
  ],
  "mathematical_requirements": "No unsupported numerical scores.",
  "tool_requirements": [
    "Host reasoning and resource reading; calculation tool when required."
  ],
  "evidence_requirements": [
    "Cite material claims; mark missing inputs UNKNOWN; do not reuse illustrative source conclusions."
  ],
  "limitations": [
    "Host-authored analysis requires behavioral evaluation; schema validity does not prove truth."
  ],
  "failure_modes": [
    "Invented inputs",
    "Generic analysis replacing distinctive method",
    "Unsupported certainty"
  ],
  "relationships": [],
  "workflow_position": "analysis",
  "validation_criteria": [
    "Provide must or declare it UNKNOWN with reason.",
    "Provide should or declare it UNKNOWN with reason.",
    "Provide could or declare it UNKNOWN with reason.",
    "Provide wont or declare it UNKNOWN with reason.",
    "Use all distinctive methodology steps and identify missing evidence."
  ],
  "reference_material": [
    {
      "document": "Cognition Os Master Blueprint.md",
      "section": "4.1 / Decision Models",
      "line": 278
    }
  ]
}
